{
  "$schema": "../../../schemas/npc-event-script.schema.json",
  "schema_version": 4,
  "id": "cobbleventure:npc/firered_super_nerd_zac",
  "enabled": true,
  "name": {
    "ko_kr": "이과계의 남자 잭",
    "en_us": "Super Nerd Zac"
  },
  "description": {
    "ko_kr": "파이어레드 테스트 배치용 트레이너입니다."
  },
  "tags": [
    "trainer",
    "generation_1",
    "kanto",
    "firered",
    "super_nerd"
  ],
  "placement_profile": {
    "classification": "trainer",
    "expected_level": 37,
    "preferred_biomes": [],
    "automatic_town_placement": false,
    "automatic_route_placement": true
  },
  "npc": {
    "battle_rewards": {
      "money": {
        "enabled": true,
        "mode": "regional_level",
        "fallback_region_level": 37,
        "per_level": 20,
        "offset": 100,
        "held_item_bonus": true,
        "held_item": "cobblemon:amulet_coin",
        "held_item_multiplier": 2,
        "conditions": []
      }
    },
    "display_name": {
      "ko_kr": "이과계의 남자 잭",
      "en_us": "Super Nerd Zac"
    },
    "role": "default",
    "trainer_class": "cobbleventure:trainer_class/super_nerd",
    "appearance": {
      "source": "rct_single",
      "type": "skin",
      "resource": "rctmod:trainers/single/super_nerd_aavery_00b2",
      "implementation_status": "ready"
    },
    "behavior": {
      "movement": "stationary",
      "look_at_player": true,
      "invulnerable": true,
      "collision": true
    }
  },
  "event_design": {
    "mode": "preset",
    "preset": {
      "type": "battle",
      "initial_trigger": {
        "type": "interact",
        "range": 4
      },
      "first_text": {
        "ko_kr": "불은 H2O에 약하지."
      },
      "battle": "cobbleventure:battle/firered_super_nerd_zac",
      "after_victory_trigger": {
        "type": "interact",
        "range": 4
      },
      "win_text": {
        "ko_kr": "이런! 불이 꺼졌어! 물은 불에 강하지만 불은 얼음을 녹여. 그래서 불꽃타입은 얼음타입에 강해."
      },
      "loss_text": {
        "ko_kr": "이번 승부는 내가 이겼어. 다시 준비해서 도전해!"
      },
      "victory_state_key": "cobbleventure:flag/trainer/firered_super_nerd_zac/defeated"
    }
  },
  "event_runtime": {
    "engine": "cves_v5",
    "authoring": "preset",
    "script_id": "cobbleventure:event_script/generation_1/firered/firered_super_nerd_zac"
  }
}
