{
  "$schema": "../../../schemas/npc-event-script.schema.json",
  "schema_version": 4,
  "id": "cobbleventure:npc/firered_camper_ethan",
  "enabled": true,
  "name": {
    "ko_kr": "캠프보이 이선",
    "en_us": "Camper Ethan"
  },
  "description": {
    "ko_kr": "파이어레드 테스트 배치용 트레이너입니다."
  },
  "tags": [
    "trainer",
    "generation_1",
    "kanto",
    "firered",
    "camper"
  ],
  "placement_profile": {
    "classification": "trainer",
    "expected_level": 18,
    "preferred_biomes": [],
    "automatic_town_placement": false,
    "automatic_route_placement": true
  },
  "npc": {
    "display_name": {
      "ko_kr": "캠프보이 이선",
      "en_us": "Camper Ethan"
    },
    "role": "default",
    "trainer_class": "cobbleventure:trainer_class/camper",
    "appearance": {
      "source": "custom",
      "type": "skin",
      "resource": "cobbleventure:trainer_skin/camper",
      "implementation_status": "ready"
    },
    "behavior": {
      "movement": "stationary",
      "look_at_player": true,
      "invulnerable": true,
      "collision": true
    }
  },
  "event_design": {
    "mode": "preset",
    "preset": {
      "type": "battle",
      "initial_trigger": {
        "type": "interact",
        "range": 4
      },
      "first_text": {
        "ko_kr": "좋아! 내가 5번이다! 짓밟아 주지!"
      },
      "battle": "cobbleventure:battle/firered_camper_ethan",
      "after_victory_trigger": {
        "type": "interact",
        "range": 4
      },
      "win_text": {
        "ko_kr": "우와! 너무 강해! 최선을 다했으니 후회 없어!"
      },
      "loss_text": {
        "ko_kr": "이번 승부는 내가 이겼어. 다시 준비해서 도전해!"
      },
      "victory_state_key": "cobbleventure:flag/trainer/firered_camper_ethan/defeated"
    }
  },
  "event_runtime": {
    "engine": "cves_v5",
    "authoring": "preset",
    "script_id": "cobbleventure:event_script/generation_1/firered/firered_camper_ethan"
  }
}
