{
  "$schema": "../../schemas/npc-event-script.schema.json",
  "schema_version": 4,
  "id": "cobbleventure:npc/rocket_power_plant_officer",
  "enabled": true,
  "name": {
    "ko_kr": "발전소 로켓단 간부"
  },
  "description": {
    "ko_kr": "점거된 발전소의 제어실을 지키는 테스트용 로켓단 간부입니다."
  },
  "tags": [
    "trainer",
    "generation_1",
    "kanto",
    "team_rocket",
    "dungeon",
    "boss"
  ],
  "placement_profile": {
    "classification": "trainer",
    "expected_level": 1,
    "preferred_biomes": [],
    "automatic_town_placement": false,
    "automatic_route_placement": false
  },
  "npc": {
    "display_name": {
      "ko_kr": "로켓단 간부"
    },
    "role": "boss",
    "trainer_class": "cobbleventure:trainer_class/villain_admin",
    "appearance": {
      "source": "rct_single",
      "type": "skin",
      "resource": "rctmod:trainers/single/rocket_admin_archer_002a"
    },
    "behavior": {
      "movement": "stationary",
      "look_at_player": true,
      "invulnerable": true,
      "collision": true
    }
  },
  "event_design": {
    "mode": "preset",
    "preset": {
      "type": "battle",
      "initial_trigger": {
        "type": "proximity",
        "range": 6,
        "warning_offset": 3,
        "indicator": "trainer_nearby"
      },
      "first_text": {
        "ko_kr": "발전소의 전력은 이제 로켓단의 것이다. 방해자는 제거한다!"
      },
      "battle": "cobbleventure:battle/rocket_power_plant_officer",
      "after_victory_trigger": {
        "type": "interact",
        "range": 4
      },
      "win_text": {
        "ko_kr": "작전은 실패다… 철수한다!"
      },
      "loss_text": {
        "ko_kr": "이 발전소는 계속 로켓단이 사용하겠다."
      },
      "victory_state_key": "cobbleventure:flag/dungeon/rocket_power_plant/boss_defeated"
    }
  },
  "event_runtime": {
    "engine": "cves_v5",
    "authoring": "preset",
    "script_id": "cobbleventure:event_script/generation_1/rocket_power_plant_officer"
  }
}
