{
  "$schema": "../../../schemas/npc-event-script.schema.json",
  "schema_version": 4,
  "id": "cobbleventure:npc/firered_juggler_kayden",
  "enabled": true,
  "name": {
    "ko_kr": "저글러 케이든",
    "en_us": "Juggler Kayden"
  },
  "description": {
    "ko_kr": "파이어레드 테스트 배치용 트레이너입니다."
  },
  "tags": [
    "trainer",
    "generation_1",
    "kanto",
    "firered",
    "juggler"
  ],
  "placement_profile": {
    "classification": "trainer",
    "expected_level": 38,
    "preferred_biomes": [],
    "automatic_town_placement": false,
    "automatic_route_placement": true
  },
  "npc": {
    "battle_rewards": {
      "money": {
        "enabled": true,
        "mode": "regional_level",
        "fallback_region_level": 38,
        "per_level": 20,
        "offset": 100,
        "held_item_bonus": true,
        "held_item": "cobblemon:amulet_coin",
        "held_item_multiplier": 2,
        "conditions": []
      }
    },
    "display_name": {
      "ko_kr": "저글러 케이든",
      "en_us": "Juggler Kayden"
    },
    "role": "default",
    "trainer_class": "cobbleventure:trainer_class/psychic",
    "appearance": {
      "source": "rct_single",
      "type": "skin",
      "resource": "rctmod:trainers/single/psychic_johan_0118",
      "implementation_status": "ready"
    },
    "behavior": {
      "movement": "stationary",
      "look_at_player": true,
      "invulnerable": true,
      "collision": true
    }
  },
  "event_design": {
    "mode": "preset",
    "preset": {
      "type": "battle",
      "initial_trigger": {
        "type": "interact",
        "range": 4
      },
      "first_text": {
        "ko_kr": "포켓몬은 힘만으로 싸우는 게 아니야. 전략이 완력을 이긴다는 걸 보여 주지!"
      },
      "battle": "cobbleventure:battle/firered_juggler_kayden",
      "after_victory_trigger": {
        "type": "interact",
        "range": 4
      },
      "win_text": {
        "ko_kr": "뭐라고? 대단하군! 힘과 지혜를 섞는군. 어린 트레이너치고 훌륭한 전략이야!"
      },
      "loss_text": {
        "ko_kr": "이번 승부는 내가 이겼어. 다시 준비해서 도전해!"
      },
      "victory_state_key": "cobbleventure:flag/trainer/firered_juggler_kayden/defeated"
    }
  },
  "event_runtime": {
    "engine": "cves_v5",
    "authoring": "preset",
    "script_id": "cobbleventure:event_script/generation_1/firered/firered_juggler_kayden"
  }
}
