{
  "$schema": "../../../schemas/npc-event-script.schema.json",
  "schema_version": 4,
  "id": "cobbleventure:npc/firered_cool_couple_ray",
  "enabled": true,
  "name": {
    "ko_kr": "엘리트 트레이너 레이",
    "en_us": "Cooltrainer Ray"
  },
  "description": {
    "ko_kr": "타이라와 함께 배치되는 더블배틀 파트너입니다. 전투와 보상은 대표 NPC가 처리합니다."
  },
  "tags": [
    "trainer",
    "generation_1",
    "kanto",
    "firered",
    "cool_couple"
  ],
  "placement_profile": {
    "classification": "trainer",
    "expected_level": 45,
    "preferred_biomes": [],
    "automatic_town_placement": false,
    "automatic_route_placement": false
  },
  "npc": {
    "battle_rewards": {
      "money": {
        "enabled": true,
        "mode": "regional_level",
        "fallback_region_level": 45,
        "per_level": 20,
        "offset": 100,
        "held_item_bonus": true,
        "held_item": "cobblemon:amulet_coin",
        "held_item_multiplier": 2,
        "conditions": []
      }
    },
    "display_name": {
      "ko_kr": "엘리트 트레이너 레이",
      "en_us": "Cooltrainer Ray"
    },
    "role": "default",
    "trainer_class": "cobbleventure:trainer_class/young_couple_male",
    "appearance": {
      "source": "custom",
      "type": "skin",
      "resource": "cobbleventure:trainer_skin/young_couple_male",
      "implementation_status": "ready"
    },
    "behavior": {
      "movement": "stationary",
      "look_at_player": true,
      "invulnerable": true,
      "collision": true
    }
  },
  "event_design": {
    "mode": "preset",
    "preset": {
      "type": "battle",
      "initial_trigger": {
        "type": "interact",
        "range": 4
      },
      "first_text": {
        "ko_kr": "레이: 우리 둘이 함께라면 위대한 트레이너가 될 운명이야!"
      },
      "battle": "cobbleventure:battle/firered_cool_couple_ray_tyra",
      "after_victory_trigger": {
        "type": "interact",
        "range": 4
      },
      "win_text": {
        "ko_kr": "레이: 말도 안 돼! 이럴 수가! 레이: 우리를 이겼군. 위대함은 아직 멀었나 봐…"
      },
      "loss_text": {
        "ko_kr": "이번 승부는 내가 이겼어. 다시 준비해서 도전해!"
      },
      "victory_state_key": "cobbleventure:flag/trainer/firered_cool_couple_ray_tyra/defeated"
    }
  },
  "event_runtime": {
    "engine": "cves_v5",
    "authoring": "custom",
    "script_id": "cobbleventure:event_script/generation_1/firered/firered_cool_couple_ray_tyra"
  }
}
