{
  "$schema": "../../../schemas/npc-event-script.schema.json",
  "schema_version": 4,
  "id": "cobbleventure:npc/firered_burglar_quinn",
  "enabled": true,
  "name": {
    "ko_kr": "도둑 퀸",
    "en_us": "Burglar Quinn"
  },
  "description": {
    "ko_kr": "파이어레드 테스트 배치용 트레이너입니다."
  },
  "tags": [
    "trainer",
    "generation_1",
    "kanto",
    "firered",
    "burglar"
  ],
  "placement_profile": {
    "classification": "trainer",
    "expected_level": 36,
    "preferred_biomes": [],
    "automatic_town_placement": false,
    "automatic_route_placement": true
  },
  "npc": {
    "display_name": {
      "ko_kr": "도둑 퀸",
      "en_us": "Burglar Quinn"
    },
    "role": "default",
    "trainer_class": "cobbleventure:trainer_class/villain_grunt",
    "appearance": {
      "source": "rct_single",
      "type": "skin",
      "resource": "rctmod:trainers/single/team_rocket_grunt_0162",
      "implementation_status": "ready"
    },
    "behavior": {
      "movement": "stationary",
      "look_at_player": true,
      "invulnerable": true,
      "collision": true
    }
  },
  "event_design": {
    "mode": "preset",
    "preset": {
      "type": "battle",
      "initial_trigger": {
        "type": "interact",
        "range": 4
      },
      "first_text": {
        "ko_kr": "예전엔 도둑이었지만 지금은 정직한 트레이너야."
      },
      "battle": "cobbleventure:battle/firered_burglar_quinn",
      "after_victory_trigger": {
        "type": "interact",
        "range": 4
      },
      "win_text": {
        "ko_kr": "항복이다! 아직도 남의 포켓몬을 훔치고 싶은 충동이 들 때가 있어."
      },
      "loss_text": {
        "ko_kr": "이번 승부는 내가 이겼어. 다시 준비해서 도전해!"
      },
      "victory_state_key": "cobbleventure:flag/trainer/firered_burglar_quinn/defeated"
    }
  },
  "event_runtime": {
    "engine": "cves_v5",
    "authoring": "preset",
    "script_id": "cobbleventure:event_script/generation_1/firered/firered_burglar_quinn"
  }
}
