{
  "$schema": "../../../schemas/npc-event-script.schema.json",
  "schema_version": 4,
  "id": "cobbleventure:npc/firered_camper_flint",
  "enabled": true,
  "name": {
    "ko_kr": "캠프보이 플린트",
    "en_us": "Camper Flint"
  },
  "description": {
    "ko_kr": "파이어레드 테스트 배치용 트레이너입니다."
  },
  "tags": [
    "trainer",
    "generation_1",
    "kanto",
    "firered",
    "camper"
  ],
  "placement_profile": {
    "classification": "trainer",
    "expected_level": 14,
    "preferred_biomes": [],
    "automatic_town_placement": false,
    "automatic_route_placement": true
  },
  "npc": {
    "display_name": {
      "ko_kr": "캠프보이 플린트",
      "en_us": "Camper Flint"
    },
    "role": "default",
    "trainer_class": "cobbleventure:trainer_class/camper",
    "appearance": {
      "source": "custom",
      "type": "skin",
      "resource": "cobbleventure:trainer_skin/camper",
      "implementation_status": "ready"
    },
    "behavior": {
      "movement": "stationary",
      "look_at_player": true,
      "invulnerable": true,
      "collision": true
    }
  },
  "event_design": {
    "mode": "preset",
    "preset": {
      "type": "battle",
      "initial_trigger": {
        "type": "interact",
        "range": 4
      },
      "first_text": {
        "ko_kr": "나는 멋진 남자야. 여자친구도 있다고!"
      },
      "battle": "cobbleventure:battle/firered_camper_flint",
      "after_victory_trigger": {
        "type": "interact",
        "range": 4
      },
      "win_text": {
        "ko_kr": "아, 이런… 뭐, 여자친구가 위로해 주겠지."
      },
      "loss_text": {
        "ko_kr": "이번 승부는 내가 이겼어. 다시 준비해서 도전해!"
      },
      "victory_state_key": "cobbleventure:flag/trainer/firered_camper_flint/defeated"
    }
  },
  "event_runtime": {
    "engine": "cves_v5",
    "authoring": "preset",
    "script_id": "cobbleventure:event_script/generation_1/firered/firered_camper_flint"
  }
}
