{
  "$schema": "../../../schemas/npc-event-script.schema.json",
  "schema_version": 4,
  "id": "cobbleventure:npc/firered_hiker_nob",
  "enabled": true,
  "name": {
    "ko_kr": "등산가 노브",
    "en_us": "Hiker Nob"
  },
  "description": {
    "ko_kr": "파이어레드 테스트 배치용 트레이너입니다."
  },
  "tags": [
    "trainer",
    "generation_1",
    "kanto",
    "firered",
    "hiker"
  ],
  "placement_profile": {
    "classification": "trainer",
    "expected_level": 13,
    "preferred_biomes": [],
    "automatic_town_placement": false,
    "automatic_route_placement": true
  },
  "npc": {
    "battle_rewards": {
      "money": {
        "enabled": true,
        "mode": "regional_level",
        "fallback_region_level": 13,
        "per_level": 20,
        "offset": 100,
        "held_item_bonus": true,
        "held_item": "cobblemon:amulet_coin",
        "held_item_multiplier": 2,
        "conditions": []
      }
    },
    "display_name": {
      "ko_kr": "등산가 노브",
      "en_us": "Hiker Nob"
    },
    "role": "default",
    "trainer_class": "cobbleventure:trainer_class/hiker",
    "appearance": {
      "source": "rct_single",
      "type": "skin",
      "resource": "rctmod:trainers/single/hiker_alan_00b9",
      "implementation_status": "ready"
    },
    "behavior": {
      "movement": "stationary",
      "look_at_player": true,
      "invulnerable": true,
      "collision": true
    }
  },
  "event_design": {
    "mode": "preset",
    "preset": {
      "type": "battle",
      "initial_trigger": {
        "type": "interact",
        "range": 4
      },
      "first_text": {
        "ko_kr": "곶에 사는 포켓몬 매니아의 수집품을 보러 가는 길이야."
      },
      "battle": "cobbleventure:battle/firered_hiker_nob",
      "after_victory_trigger": {
        "type": "interact",
        "range": 4
      },
      "win_text": {
        "ko_kr": "제대로 당했군! 그 포켓몬 매니아는 이름값을 해. 희귀한 포켓몬도 많이 모았대."
      },
      "loss_text": {
        "ko_kr": "이번 승부는 내가 이겼어. 다시 준비해서 도전해!"
      },
      "victory_state_key": "cobbleventure:flag/trainer/firered_hiker_nob/defeated"
    }
  },
  "event_runtime": {
    "engine": "cves_v5",
    "authoring": "preset",
    "script_id": "cobbleventure:event_script/generation_1/firered/firered_hiker_nob"
  }
}
