{
  "$schema": "../../../schemas/npc-event-script.schema.json",
  "schema_version": 4,
  "id": "cobbleventure:npc/firered_cooltrainer_alexa",
  "enabled": true,
  "name": {
    "ko_kr": "엘리트 트레이너 알렉사",
    "en_us": "Cooltrainer Alexa"
  },
  "description": {
    "ko_kr": "파이어레드 테스트 배치용 트레이너입니다."
  },
  "tags": [
    "trainer",
    "generation_1",
    "kanto",
    "firered",
    "cooltrainer"
  ],
  "placement_profile": {
    "classification": "trainer",
    "expected_level": 42,
    "preferred_biomes": [],
    "automatic_town_placement": false,
    "automatic_route_placement": true
  },
  "npc": {
    "display_name": {
      "ko_kr": "엘리트 트레이너 알렉사",
      "en_us": "Cooltrainer Alexa"
    },
    "role": "default",
    "trainer_class": "cobbleventure:trainer_class/ace_trainer_female",
    "appearance": {
      "source": "custom",
      "type": "skin",
      "resource": "cobbleventure:trainer_skin/ace_trainer_female",
      "implementation_status": "ready"
    },
    "behavior": {
      "movement": "stationary",
      "look_at_player": true,
      "invulnerable": true,
      "collision": true
    }
  },
  "event_design": {
    "mode": "preset",
    "preset": {
      "type": "battle",
      "initial_trigger": {
        "type": "interact",
        "range": 4
      },
      "first_text": {
        "ko_kr": "트레이너는 더 강한 상대를 찾아 살아가는 법이지."
      },
      "battle": "cobbleventure:battle/firered_cooltrainer_alexa",
      "after_victory_trigger": {
        "type": "interact",
        "range": 4
      },
      "win_text": {
        "ko_kr": "아! 정말 강하군! 힘든 승부를 거치며 더욱 강해지는 거야."
      },
      "loss_text": {
        "ko_kr": "이번 승부는 내가 이겼어. 다시 준비해서 도전해!"
      },
      "victory_state_key": "cobbleventure:flag/trainer/firered_cooltrainer_alexa/defeated"
    }
  },
  "event_runtime": {
    "engine": "cves_v5",
    "authoring": "preset",
    "script_id": "cobbleventure:event_script/generation_1/firered/firered_cooltrainer_alexa"
  }
}
