{
  "$schema": "../../schemas/npc-event-script.schema.json",
  "schema_version": 4,
  "id": "cobbleventure:npc/rocket_silph_guard",
  "enabled": true,
  "name": {
    "ko_kr": "실프 사옥 경비"
  },
  "description": {
    "ko_kr": "점거된 실프 사옥의 중층을 지키는 로켓단입니다."
  },
  "tags": [
    "trainer",
    "generation_1",
    "kanto",
    "team_rocket",
    "dungeon"
  ],
  "placement_profile": {
    "classification": "trainer",
    "expected_level": 1,
    "preferred_biomes": [],
    "automatic_town_placement": false,
    "automatic_route_placement": false
  },
  "npc": {
    "battle_rewards": {
      "money": {
        "enabled": true,
        "mode": "regional_level",
        "fallback_region_level": 25,
        "per_level": 20,
        "offset": 100,
        "held_item_bonus": true,
        "held_item": "cobblemon:amulet_coin",
        "held_item_multiplier": 2,
        "conditions": []
      }
    },
    "display_name": {
      "ko_kr": "실프 사옥 경비"
    },
    "role": "default",
    "trainer_class": "cobbleventure:trainer_class/villain_grunt",
    "appearance": {
      "source": "custom",
      "type": "skin",
      "resource": "cobbleventure:trainer_skin/team_rocket_grunt_male"
    },
    "behavior": {
      "movement": "stationary",
      "look_at_player": true,
      "invulnerable": true,
      "collision": true
    }
  },
  "event_design": {
    "mode": "preset",
    "preset": {
      "type": "battle",
      "initial_trigger": {
        "type": "proximity",
        "range": 6,
        "warning_offset": 3,
        "indicator": "trainer_nearby"
      },
      "first_text": {
        "ko_kr": "엘리베이터는 봉쇄됐다. 계단으로도 위에는 못 간다!"
      },
      "battle": "cobbleventure:battle/rocket_power_plant_grunt",
      "after_victory_trigger": {
        "type": "interact",
        "range": 4
      },
      "win_text": {
        "ko_kr": "최상층 경비를 불러야 해…"
      },
      "loss_text": {
        "ko_kr": "이 빌딩은 이미 우리 것이다!"
      },
      "victory_state_key": "cobbleventure:flag/trainer/rocket_silph_guard/defeated"
    }
  },
  "event_runtime": {
    "engine": "cves_v5",
    "authoring": "preset",
    "script_id": "cobbleventure:event_script/generation_1/rocket_silph_guard"
  }
}
