{
  "$schema": "../../../schemas/npc-event-script.schema.json",
  "schema_version": 4,
  "id": "cobbleventure:npc/firered_bug_catcher_cale",
  "enabled": true,
  "name": {
    "ko_kr": "곤충채집소년 케일",
    "en_us": "Bug Catcher Cale"
  },
  "description": {
    "ko_kr": "파이어레드 테스트 배치용 트레이너입니다."
  },
  "tags": [
    "trainer",
    "generation_1",
    "kanto",
    "firered",
    "bug_catcher"
  ],
  "placement_profile": {
    "classification": "trainer",
    "expected_level": 10,
    "preferred_biomes": [],
    "automatic_town_placement": false,
    "automatic_route_placement": true
  },
  "npc": {
    "display_name": {
      "ko_kr": "곤충채집소년 케일",
      "en_us": "Bug Catcher Cale"
    },
    "role": "default",
    "trainer_class": "cobbleventure:trainer_class/bug_catcher",
    "appearance": {
      "source": "custom",
      "type": "skin",
      "resource": "cobbleventure:trainer_skin/bug_catcher",
      "implementation_status": "ready"
    },
    "behavior": {
      "movement": "stationary",
      "look_at_player": true,
      "invulnerable": true,
      "collision": true
    }
  },
  "event_design": {
    "mode": "preset",
    "preset": {
      "type": "battle",
      "initial_trigger": {
        "type": "interact",
        "range": 4
      },
      "first_text": {
        "ko_kr": "여기는 금구슬다리! 우리 다섯을 이기면 멋진 상품을 받지. 해낼 수 있겠어?"
      },
      "battle": "cobbleventure:battle/firered_bug_catcher_cale",
      "after_victory_trigger": {
        "type": "interact",
        "range": 4
      },
      "win_text": {
        "ko_kr": "우와! 훌륭해! 최선을 다했으니 후회 없어!"
      },
      "loss_text": {
        "ko_kr": "이번 승부는 내가 이겼어. 다시 준비해서 도전해!"
      },
      "victory_state_key": "cobbleventure:flag/trainer/firered_bug_catcher_cale/defeated"
    }
  },
  "event_runtime": {
    "engine": "cves_v5",
    "authoring": "preset",
    "script_id": "cobbleventure:event_script/generation_1/firered/firered_bug_catcher_cale"
  }
}
