{
  "$schema": "../../schemas/npc-event-script.schema.json",
  "schema_version": 4,
  "id": "cobbleventure:npc/kanto_black_belt_hyuk",
  "enabled": true,
  "name": {
    "ko_kr": "태권왕 혁"
  },
  "description": {
    "ko_kr": "석영고원으로 향하는 길에서 수련하는 1세대 격투 트레이너입니다."
  },
  "tags": [
    "trainer",
    "generation_1",
    "kanto",
    "black_belt"
  ],
  "placement_profile": {
    "classification": "trainer",
    "expected_level": 42,
    "preferred_biomes": [
      "minecraft:stony_peaks",
      "minecraft:windswept_hills"
    ],
    "automatic_town_placement": false,
    "automatic_route_placement": true
  },
  "npc": {
    "display_name": {
      "ko_kr": "태권왕 혁"
    },
    "role": "default",
    "trainer_class": "cobbleventure:trainer_class/black_belt",
    "battle_rewards": {
      "money": {
        "enabled": true,
        "mode": "regional_level",
        "fallback_region_level": 42,
        "per_level": 20,
        "offset": 100,
        "held_item_bonus": true,
        "held_item": "cobblemon:amulet_coin",
        "held_item_multiplier": 2,
        "conditions": []
      }
    },
    "appearance": {
      "source": "rct_single",
      "type": "skin",
      "resource": "rctmod:trainers/single/black_belt_hitoshi_0141"
    },
    "behavior": {
      "movement": "stationary",
      "look_at_player": true,
      "invulnerable": true,
      "collision": true
    }
  },
  "event_design": {
    "mode": "preset",
    "preset": {
      "type": "battle",
      "initial_trigger": {
        "type": "interact",
        "range": 4
      },
      "first_text": {
        "ko_kr": "석영고원은 단련된 자만 지나갈 수 있다!"
      },
      "battle": "cobbleventure:battle/kanto_black_belt_hyuk",
      "after_victory_trigger": {
        "type": "interact",
        "range": 4
      },
      "win_text": {
        "ko_kr": "좋다! 네 수련은 진짜로군!"
      },
      "loss_text": {
        "ko_kr": "정신과 몸을 함께 단련하고 돌아와라!"
      },
      "victory_state_key": "cobbleventure:flag/trainer/kanto_black_belt_hyuk/defeated"
    }
  },
  "event_runtime": {
    "engine": "cves_v5",
    "authoring": "preset",
    "script_id": "cobbleventure:event_script/generation_1/kanto_black_belt_hyuk"
  }
}
