{
  "$schema": "../../../schemas/npc-event-script.schema.json",
  "schema_version": 4,
  "id": "cobbleventure:npc/firered_tamer_jason",
  "enabled": true,
  "name": {
    "ko_kr": "포켓몬 조련사 제이슨",
    "en_us": "Tamer Jason"
  },
  "description": {
    "ko_kr": "파이어레드 테스트 배치용 트레이너입니다."
  },
  "tags": [
    "trainer",
    "generation_1",
    "kanto",
    "firered",
    "tamer"
  ],
  "placement_profile": {
    "classification": "trainer",
    "expected_level": 43,
    "preferred_biomes": [],
    "automatic_town_placement": false,
    "automatic_route_placement": true
  },
  "npc": {
    "display_name": {
      "ko_kr": "포켓몬 조련사 제이슨",
      "en_us": "Tamer Jason"
    },
    "role": "default",
    "trainer_class": "cobbleventure:trainer_class/tamer",
    "appearance": {
      "source": "custom",
      "type": "skin",
      "resource": "cobbleventure:trainer_skin/tamer",
      "implementation_status": "ready"
    },
    "behavior": {
      "movement": "stationary",
      "look_at_player": true,
      "invulnerable": true,
      "collision": true
    }
  },
  "event_design": {
    "mode": "preset",
    "preset": {
      "type": "battle",
      "initial_trigger": {
        "type": "interact",
        "range": 4
      },
      "first_text": {
        "ko_kr": "포켓몬과 나는 함께 멋진 음악을 만들지!"
      },
      "battle": "cobbleventure:battle/firered_tamer_jason",
      "after_victory_trigger": {
        "type": "interact",
        "range": 4
      },
      "win_text": {
        "ko_kr": "완벽한 조화로군! 우리 체육관 관장의 정체를 알고 있나?"
      },
      "loss_text": {
        "ko_kr": "이번 승부는 내가 이겼어. 다시 준비해서 도전해!"
      },
      "victory_state_key": "cobbleventure:flag/trainer/firered_tamer_jason/defeated"
    }
  },
  "event_runtime": {
    "engine": "cves_v5",
    "authoring": "preset",
    "script_id": "cobbleventure:event_script/generation_1/firered/firered_tamer_jason"
  }
}
