{
  "$schema": "../../../schemas/npc-event-script.schema.json",
  "schema_version": 4,
  "id": "cobbleventure:npc/firered_cooltrainer_mary",
  "enabled": true,
  "name": {
    "ko_kr": "엘리트 트레이너 메리",
    "en_us": "Cooltrainer Mary"
  },
  "description": {
    "ko_kr": "파이어레드 테스트 배치용 트레이너입니다."
  },
  "tags": [
    "trainer",
    "generation_1",
    "kanto",
    "firered",
    "cooltrainer"
  ],
  "placement_profile": {
    "classification": "trainer",
    "expected_level": 22,
    "preferred_biomes": [],
    "automatic_town_placement": false,
    "automatic_route_placement": true
  },
  "npc": {
    "battle_rewards": {
      "money": {
        "enabled": true,
        "mode": "regional_level",
        "fallback_region_level": 22,
        "per_level": 20,
        "offset": 100,
        "held_item_bonus": true,
        "held_item": "cobblemon:amulet_coin",
        "held_item_multiplier": 2,
        "conditions": []
      }
    },
    "display_name": {
      "ko_kr": "엘리트 트레이너 메리",
      "en_us": "Cooltrainer Mary"
    },
    "role": "default",
    "trainer_class": "cobbleventure:trainer_class/ace_trainer_female",
    "appearance": {
      "source": "custom",
      "type": "skin",
      "resource": "cobbleventure:trainer_skin/ace_trainer_female",
      "implementation_status": "ready"
    },
    "behavior": {
      "movement": "stationary",
      "look_at_player": true,
      "invulnerable": true,
      "collision": true
    }
  },
  "event_design": {
    "mode": "preset",
    "preset": {
      "type": "battle",
      "initial_trigger": {
        "type": "interact",
        "range": 4
      },
      "first_text": {
        "ko_kr": "무지개체육관에 온 걸 환영해! 여기의 상냥한 숙녀들을 얕보지 마."
      },
      "battle": "cobbleventure:battle/firered_cooltrainer_mary",
      "after_victory_trigger": {
        "type": "interact",
        "range": 4
      },
      "win_text": {
        "ko_kr": "어머! 져 버렸어! 가장 강한 포켓몬은 데려오지 않았어. 다음에는 다를걸!"
      },
      "loss_text": {
        "ko_kr": "이번 승부는 내가 이겼어. 다시 준비해서 도전해!"
      },
      "victory_state_key": "cobbleventure:flag/trainer/firered_cooltrainer_mary/defeated"
    }
  },
  "event_runtime": {
    "engine": "cves_v5",
    "authoring": "preset",
    "script_id": "cobbleventure:event_script/generation_1/firered/firered_cooltrainer_mary"
  }
}
