{
  "$schema": "../../../schemas/npc-event-script.schema.json",
  "schema_version": 4,
  "id": "cobbleventure:npc/firered_cooltrainer_george",
  "enabled": true,
  "name": {
    "ko_kr": "Cooltrainer George",
    "en_us": "Cooltrainer George"
  },
  "description": {
    "ko_kr": "파이어레드 테스트 배치용 트레이너입니다."
  },
  "tags": [
    "trainer",
    "generation_1",
    "kanto",
    "firered",
    "cooltrainer"
  ],
  "placement_profile": {
    "classification": "trainer",
    "expected_level": 42,
    "preferred_biomes": [],
    "automatic_town_placement": false,
    "automatic_route_placement": true
  },
  "npc": {
    "display_name": {
      "ko_kr": "Cooltrainer George",
      "en_us": "Cooltrainer George"
    },
    "role": "default",
    "trainer_class": "cobbleventure:trainer_class/ace_trainer_male",
    "appearance": {
      "source": "custom",
      "type": "skin",
      "resource": "cobbleventure:trainer_skin/ace_trainer_male",
      "implementation_status": "ready"
    },
    "behavior": {
      "movement": "stationary",
      "look_at_player": true,
      "invulnerable": true,
      "collision": true
    }
  },
  "event_design": {
    "mode": "preset",
    "preset": {
      "type": "battle",
      "initial_trigger": {
        "type": "interact",
        "range": 4
      },
      "first_text": {
        "ko_kr": "승부하자!"
      },
      "battle": "cobbleventure:battle/firered_cooltrainer_george",
      "after_victory_trigger": {
        "type": "interact",
        "range": 4
      },
      "win_text": {
        "ko_kr": "좋은 승부였어!"
      },
      "loss_text": {
        "ko_kr": "다시 준비해서 도전해!"
      },
      "victory_state_key": "cobbleventure:flag/trainer/firered_cooltrainer_george/defeated"
    }
  },
  "event_runtime": {
    "engine": "cves_v5",
    "authoring": "preset",
    "script_id": "cobbleventure:event_script/generation_1/firered_cooltrainer_george"
  }
}
